### ISSUE TITLE
WebSocket handshake stopped working in 4.4.5

### ISSUE THREAD

**Issue by chemist777** [eclipse-vertx/vert.x#4887]
My Vert.x-based server has stopped accepting WebSocket connections starting from 4.4.5 if an nginx is used in front of Vert.x.
The underlying TCP connection is closed automatically upon a successful handshake.
With 4.4.4, everything is working fine.

Debugging showed that most likely the problem is with [this new line of code in Http1xServerConnection.java](https://github.com/eclipse-vertx/vert.x/blob/master/src/main/java/io/vertx/core/http/impl/Http1xServerConnection.java#L261C12-L261C12) added to 4.4.5:
```
void responseComplete() {
...
        if (keepAlive) {
          Http1xServerRequest next = request.next();
          if (next != null) {
            // Handle pipelined request
            handleNext(next);
          }
        } else {
          if (requestInProgress == request) {
            // Deferred
          } else {
            flushAndClose();
          }
        }
...
  }
```
In 4.4.4, flushAndClose isn't called on a handshake and the connection remains open.

**Comment by chemist777** [comment]
As I understand now, the problem can be reproduced if a WebSocket handshake doesn't use keepAlive.

**Comment by vietj** [comment]
thanks for the info, will add a test for this and fix it

**Comment by vietj** [comment]
keep alive means using a Connection: close header with HTTP/1.1, which means that the Connection: Upgrade header cannot be present. Can you show a TCP dump of the upgrade request ?

**Comment by chemist777** [comment]
I can't provide a dump at the moment but headers should be clear from the nginx configuration I use:

```
location /some-location {
    proxy_pass          http://some-backend;
    proxy_set_header    Host $http_host;
    proxy_set_header    Upgrade $http_upgrade;
    proxy_set_header    Connection "Upgrade";
    proxy_buffering     off;
    proxy_read_timeout  15m;
}
```

**Comment by chemist777** [comment]
Captured a full dump
```
08:30:35.857203 IP (tos 0x0, ttl 64, id 46307, offset 0, flags [DF], proto TCP (6), length 60)
    localhost.33874 > localhost.http-alt: Flags [S], cksum 0xfe30 (incorrect -> 0xb634), seq 2832072384, win 65495, options [mss 65495,sackOK,TS val 1989138380 ecr 0,nop,wscale 7], length 0
08:30:35.857211 IP (tos 0x0, ttl 64, id 0, offset 0, flags [DF], proto TCP (6), length 60)
    localhost.http-alt > localhost.33874: Flags [S.], cksum 0xfe30 (incorrect -> 0xc0b3), seq 4253591958, ack 2832072385, win 65483, options [mss 65495,sackOK,TS val 1989138380 ecr 1989138380,nop,wscale 7], length 0
08:30:35.857218 IP (tos 0x0, ttl 64, id 46308, offset 0, flags [DF], proto TCP (6), length 52)
    localhost.33874 > localhost.http-alt: Flags [.], cksum 0xfe28 (incorrect -> 0xe76f), ack 1, win 512, options [nop,nop,TS val 1989138380 ecr 1989138380], length 0
08:30:35.857239 IP (tos 0x0, ttl 64, id 46309, offset 0, flags [DF], proto TCP (6), length 370)
    localhost.33874 > localhost.http-alt: Flags [P.], cksum 0xff66 (incorrect -> 0x42f1), seq 1:319, ack 1, win 512, options [nop,nop,TS val 1989138380 ecr 1989138380], length 318: HTTP, length: 318
	GET /some-location HTTP/1.0
	Host: 127.0.0.1
	X-Forwarded-Proto: http
	Upgrade: websocket
	Connection: Upgrade
	Sec-WebSocket-Version: 13
	Sec-WebSocket-Key: Qn7k1IBM6Z9aVi+BhE+U0w==
	Sec-WebSocket-Extensions: permessage-deflate; client_max_window_bits
	
08:30:35.857242 IP (tos 0x0, ttl 64, id 31868, offset 0, flags [DF], proto TCP (6), length 52)
    localhost.http-alt > localhost.33874: Flags [.], cksum 0xfe28 (incorrect -> 0xe633), ack 319, win 510, options [nop,nop,TS val 1989138380 ecr 1989138380], length 0
08:30:35.870860 IP (tos 0x0, ttl 64, id 31869, offset 0, flags [DF], proto TCP (6), length 227)
    localhost.http-alt > localhost.33874: Flags [P.], cksum 0xfed7 (incorrect -> 0xaab8), seq 1:176, ack 319, win 512, options [nop,nop,TS val 1989138394 ecr 1989138380], length 175: HTTP, length: 175
	HTTP/1.1 101 Switching Protocols
	upgrade: websocket
	connection: upgrade
	sec-websocket-accept: aikM+nceOof64QTIQ594YGUzaNA=
	sec-websocket-extensions: permessage-deflate
	
08:30:35.870869 IP (tos 0x0, ttl 64, id 46310, offset 0, flags [DF], proto TCP (6), length 52)
    localhost.33874 > localhost.http-alt: Flags [.], cksum 0xfe28 (incorrect -> 0xe567), ack 176, win 511, options [nop,nop,TS val 1989138394 ecr 1989138394], length 0
08:30:35.871084 IP (tos 0x0, ttl 64, id 31870, offset 0, flags [DF], proto TCP (6), length 56)
    localhost.http-alt > localhost.33874: Flags [P.], cksum 0xfe2c (incorrect -> 0x5970), seq 176:180, ack 319, win 512, options [nop,nop,TS val 1989138394 ecr 1989138394], length 4: HTTP
08:30:35.871089 IP (tos 0x0, ttl 64, id 46311, offset 0, flags [DF], proto TCP (6), length 52)
    localhost.33874 > localhost.http-alt: Flags [.], cksum 0xfe28 (incorrect -> 0xe563), ack 180, win 511, options [nop,nop,TS val 1989138394 ecr 1989138394], length 0
08:30:35.874348 IP (tos 0x0, ttl 64, id 46312, offset 0, flags [DF], proto TCP (6), length 60)
    localhost.33874 > localhost.http-alt: Flags [P.], cksum 0xfe30 (incorrect -> 0xec8c), seq 319:327, ack 180, win 512, options [nop,nop,TS val 1989138398 ecr 1989138394], length 8: HTTP
08:30:35.874828 IP (tos 0x0, ttl 64, id 46313, offset 0, flags [DF], proto TCP (6), length 52)
    localhost.33874 > localhost.http-alt: Flags [F.], cksum 0xfe28 (incorrect -> 0xe555), seq 327, ack 180, win 512, options [nop,nop,TS val 1989138398 ecr 1989138394], length 0
08:30:35.874964 IP (tos 0x0, ttl 64, id 31871, offset 0, flags [DF], proto TCP (6), length 52)
    localhost.http-alt > localhost.33874: Flags [F.], cksum 0xfe28 (incorrect -> 0xe550), seq 180, ack 328, win 512, options [nop,nop,TS val 1989138398 ecr 1989138398], length 0
08:30:35.874977 IP (tos 0x0, ttl 64, id 46314, offset 0, flags [DF], proto TCP (6), length 52)
    localhost.33874 > localhost.http-alt: Flags [.], cksum 0xfe28 (incorrect -> 0xe550), ack 181, win 512, options [nop,nop,TS val 1989138398 ecr 1989138398], length 0
```

**Comment by chemist777** [comment]
Nginx by design always sends requests to backends using HTTP/1.0. Maybe it triggers the closure in 4.4.5.

**Comment by chemist777** [comment]
Yes, if I change Nginx defaults by adding `proxy_http_version 1.1;` to its config, Vert.x starts to accept connections again.

**Comment by vietj** [comment]
thanks , the vertx HTTP server should be able to handle such upgrade, we'll fix it in the next release
